{"$schema":"https://json-schema.org/draft/2020-12/schema","$id":"https://localize-anything.dev/schemas/provider-smoke-remaining-blockers.schema.json","title":"Provider Smoke Remaining Blockers","type":"object","required":["protocol_version","schema","artifact","status","blockers","summary","forbidden_claims","provider_or_model_called_by_runtime"],"properties":{"protocol_version":{"const":"0.1"},"schema":{"const":"localize-anything-provider-smoke-remaining-blockers-v1"},"artifact":{"const":"provider-smoke-remaining-blockers.json"},"status":{"const":"blockers_remaining"},"blockers":{"type":"array","items":{"type":"object"}},"summary":{"type":"object"},"forbidden_claims":{"type":"array","items":{"type":"string"}},"provider_or_model_called_by_runtime":{"const":false}},"additionalProperties":true}
