{"protocol_version":"0.1","schema":"localize-anything-provider-smoke-remaining-blockers-v1","artifact":"provider-smoke-remaining-blockers.json","status":"blockers_remaining","blockers":[{"blocker_id":"no_independent_semantic_review","status":"active","blocks":["provider_backed_quality","production_ready","benchmark_expansion","release_promotion"]},{"blocker_id":"only_two_public_fixture_segments","status":"active","blocks":["provider_backed_quality","production_ready","benchmark_expansion","release_promotion"]},{"blocker_id":"no_benchmark_scale_run","status":"active","blocks":["provider_backed_quality","production_ready","benchmark_expansion","release_promotion"]},{"blocker_id":"no_provider_reliability_sample","status":"active","blocks":["provider_backed_quality","production_ready","benchmark_expansion","release_promotion"]},{"blocker_id":"no_runtime_managed_real_execution","status":"active","blocks":["provider_backed_quality","production_ready","benchmark_expansion","release_promotion"]},{"blocker_id":"no_release_promotion_evidence","status":"active","blocks":["provider_backed_quality","production_ready","benchmark_expansion","release_promotion"]}],"summary":{"active_count":6},"forbidden_claims":["full_product_localization","locale_complete","production_ready","provider_backed_quality"],"provider_or_model_called_by_runtime":false}
